{
  "id": "intempt-technologies",
  "title": "Intempt Technologies",
  "subtitle": "Personalization ideas, practices and proof",
  "tags": [
    "optimization-personalization-&-testing"
  ],
  "category": "Other",
  "specType": "auto-detect",
  "authType": "api-key",
  "logo": "https://res.cloudinary.com/apideck/image/upload/v1554720527/catalog/intempt-technologies/icon128x128.jpg",
  "website": "https://intempt.com"
}
