{
  "id": "venn-tv",
  "title": "VENN",
  "subtitle": "VENN is a new kind of TV network for the streaming generation, aimed at gaming, pop culture, and esports audiences.",
  "tags": [
    "streaming-networks"
  ],
  "category": "Other",
  "specType": "auto-detect",
  "authType": "api-key",
  "logo": "https://res.cloudinary.com/apideck/image/upload/v1603219649/icons/venn-tv.jpg",
  "website": "https://www.venn.tv/"
}
