{
  "id": "prodly-co",
  "title": "Prodly",
  "subtitle": "Prodly Moover makes migrating relational data easy between Salesforce organizations. ",
  "tags": [
    "salesforce",
    "migration"
  ],
  "category": "Other",
  "specType": "auto-detect",
  "authType": "api-key",
  "logo": "https://res.cloudinary.com/apideck/image/upload/v1564780611/catalog/prodly-co/icon128x128.jpg",
  "website": "https://prodly.co"
}
