{
  "id": "coachhub-io",
  "title": "CoachHub",
  "subtitle": "1,000+ international, certified coaches. AI-based coach matching. CoachHub is the digital coaching platform for remot...",
  "tags": [
    "digital-coaching"
  ],
  "category": "Other",
  "specType": "auto-detect",
  "authType": "api-key",
  "logo": "https://res.cloudinary.com/apideck/image/upload/v1630505507/icons/coachhub-io.jpg",
  "website": "https://coachhub.io/"
}
