{
  "id": "bombbomb",
  "title": "BombBomb",
  "subtitle": "Simple videos get you face to face with more people more often. Easily record and send video email from Gmail, mobile...",
  "tags": [
    "sales-automation-enablement-&-intelligence"
  ],
  "category": "Other",
  "specType": "auto-detect",
  "authType": "api-key",
  "logo": "https://res.cloudinary.com/apideck/image/upload/v1545178316/catalog/bombbomb/icon128x128.png",
  "website": "https://bombbomb.com"
}
