{
  "id": "wrap",
  "title": "Wrap",
  "subtitle": "Supercharge your Marketing, Sales and Service by creating, automating, and mobile app like experiences in the moment ...",
  "tags": [
    "interactive-content"
  ],
  "category": "Other",
  "specType": "auto-detect",
  "authType": "api-key",
  "logo": "https://res.cloudinary.com/apideck/image/upload/v1581565920/catalog/wrap/icon128x128.png",
  "website": "https://wrap.co"
}
