{
  "id": "lens-ai",
  "title": "LensAI",
  "subtitle": "LensAI artificial intelligence and advertising platform that places ads directly into objects that are found through ...",
  "tags": [
    "contextual-advertising"
  ],
  "category": "Other",
  "specType": "auto-detect",
  "authType": "api-key",
  "logo": "https://res.cloudinary.com/apideck/image/upload/v1671130406/icons/lens-ai.png",
  "website": "https://lens-ai.com/"
}
