{
  "id": "shopular",
  "title": "Shopular",
  "subtitle": "Shopular API integration",
  "tags": [
    "mobile-marketing"
  ],
  "category": "Other",
  "specType": "auto-detect",
  "authType": "api-key",
  "logo": "https://res.cloudinary.com/apideck/image/upload/v1554437306/catalog/shopular/icon128x128.png",
  "website": "https://shopular.com"
}
