{
  "id": "brandsystems",
  "title": "Brandsystems",
  "subtitle": "Brandsystems API integration",
  "tags": [
    "dam-&-mrm"
  ],
  "category": "Other",
  "specType": "auto-detect",
  "authType": "api-key",
  "logo": "https://res.cloudinary.com/apideck/image/upload/v1554719230/catalog/brandsystems/icon128x128.png",
  "website": "https://brandsystems.com"
}
