{
  "id": "mobfox",
  "title": "MobFox",
  "subtitle": "MobFox API integration",
  "tags": [
    "mobile-marketing"
  ],
  "category": "Other",
  "specType": "auto-detect",
  "authType": "api-key",
  "logo": "https://res.cloudinary.com/apideck/image/upload/v1554435911/catalog/mobfox/icon128x128.png",
  "website": "https://mobfox.com"
}
