{
  "id": "swapcard",
  "title": "Swapcard",
  "subtitle": "The most intuitive platform for event organizers to engage their audiences. Connect attendees and boost exhibitors RO...",
  "tags": [
    "events-meetings-&-webinars"
  ],
  "category": "Other",
  "specType": "auto-detect",
  "authType": "api-key",
  "logo": "https://res.cloudinary.com/apideck/image/upload/v1555946513/catalog/swapcard/icon128x128.jpg",
  "website": "https://swapcard.com"
}
