{
  "id": "swarmify",
  "title": "Swarmify",
  "subtitle": "Unlimited video cdn and hosting for business. Acceleration, player, encoding, delivery. Effortless video platform wit...",
  "tags": [
    "video-cdn"
  ],
  "category": "Other",
  "specType": "auto-detect",
  "authType": "api-key",
  "logo": "https://res.cloudinary.com/apideck/image/upload/v1562760276/catalog/swarmify/icon128x128.jpg",
  "website": "https://swarmify.com",
  "docsUrl": "https://docs.swarmify.com"
}
